Naam,Omschrijving,eenheid,datatype,waarde,verkeersregel,standaard wettelijke maximumsnelheid,lokale wettelijke maximumsnelheid,adviessnelheid,voorrang verlenen,stoppen,geslotenverklaring
Omschrijving,De definitie van de verkeersregel,,,,verkeersregel
Snelheid,De standaard wettelijke of lokale wettelijke maximumsnelheid,km/h,xsd:decimal,,,standaard wettelijke maximumsnelheid,lokale wettelijke maximumsnelheid,adviessnelheid
BijNatWegdek,Geldigheid van verkeersregel bij nat wegdek,Omschrijving,,xsd:string,,,lokale wettelijke maximumsnelheid
Starttijd,Starttijd van de geldigheid van verkeersregel op specifieke tijden,Starttijd,time,xsd:time,,standaard wettelijke maximumsnelheid,lokale wettelijke maximumsnelheid,adviessnelheid,,,,
Eindtijd,Eindtijd van de geldigheid van verkeersregel op specifieke tijden,time,xsd:time,,standaard wettelijke maximumsnelheid,lokale wettelijke maximumsnelheid,adviessnelheid,,,,
Startdatum,Geldigheid van verkeersregel op specifieke kalenderdagen beginnend bij de startdatum,Startdatum,time,xsd:gMonthDay,,standaard wettelijke maximumsnelheid,lokale wettelijke maximumsnelheid,adviessnelheid,,,,
Einddatum,Geldigheid van verkeersregel op specifieke kalenderdagen eindigend op de einddatum,Einddatum,time,xsd:gMonthDay,,standaard wettelijke maximumsnelheid,lokale wettelijke maximumsnelheid,adviessnelheid,,,,
Dagaanduiding,geldigheid van verkeersregel op een of meer specifieke weekdagen,Dag,xsd:string,,,standaard wettelijke maximumsnelheid,lokale wettelijke maximumsnelheid,adviessnelheid,,,,




UitgezonderdVoertuigtype,de verkeersregel is niet van toepassing op gespecificeerd voertuigtype,,waardelijst,,,,,,,,geslotenverklaring
UitgezonderdParkeervakken,de verkeersregel is niet van toepassing op de parkeervakken,,waardelijst,,,,,,,,
GeldtVoorVoertuigtype,de verkeersregel is alleen van toepassing op gespecificeerd voertuigtype,,waardelijst,,,,,,,,
Zonsop- tot zonsondergang,geldigheid van verkeersregel 